<?xml version="1.0" encoding="UTF-8"?>
<!DOCTYPE tiendas SYSTEM "ej1_DTD.dtd">
<tiendas>
  <tienda>
  	<nombre>TecnoSur</nombre>
  	<direccion>C/ Huelva, 24</direccion>
  	<distribuidor>...</distribuidor>
  	<movil>
  		<codigo>654</codigo>
  		<marca>Xiaomi</marca>
  		<caracteristicas>6Gb Ram</caracteristicas>
  	</movil>
  </tienda>
 </tiendas>
  

